{
  "schemaVersion": "0.1",
  "traceId": "worker-unobserved-001",
  "outcome": "success",
  "input": {
    "source": "core-tools-log",
    "adapter": "CoreToolsLogAdapter",
    "adapterVersion": "0.1"
  },
  "runtime": {
    "environment": "local",
    "language": "python",
    "trigger": "http",
    "coreToolsVersion": "4.6.0+ab90faafcab539d63cd3d0ce5faf1bca4395fccc",
    "hostVersion": "4.1045.200.25556"
  },
  "application": {
    "functionName": "hello",
    "sourceFile": "function_app.py",
    "sourceText": "import azure.functions as func\n\napp = func.FunctionApp()\n\n\n@app.route(route=\"hello\")\ndef hello(req: func.HttpRequest) -> func.HttpResponse:\n    name = req.params.get(\"name\") or \"Azure\"\n    return func.HttpResponse(f\"Hello, {name}!\")\n",
    "definitionLineRange": [
      6,
      9
    ],
    "highlightConfidence": "inferred"
  },
  "lanes": {
    "client": {
      "status": "reached",
      "confidence": "inferred",
      "reason": "Derived from host HTTP request/response lines."
    },
    "host": {
      "status": "reached",
      "confidence": "observed"
    },
    "python-worker": {
      "status": "unknown",
      "confidence": "inferred",
      "reason": "Host invocation was observed, but WorkerReceivedInvocation was absent; worker/gRPC debug logging may not be enabled, so worker delivery is unknown."
    },
    "application": {
      "status": "unknown",
      "confidence": "inferred",
      "reason": "Application start was not inferred, and worker delivery is unknown."
    }
  },
  "events": [
    {
      "id": "e0",
      "sequence": 0,
      "timestamp": "2026-09-05T00:45:16.955Z",
      "elapsedMs": 0,
      "lane": "client",
      "event": "HttpRequestReceived",
      "httpRequestId": "2d0db691-8e70-4335-a8a9-e127715fa678",
      "confidence": "inferred",
      "raw": "[2026-09-05T00:45:16.955Z] Executing HTTP request: {\n[2026-09-05T00:45:16.955Z]   \"requestId\": \"2d0db691-8e70-4335-a8a9-e127715fa678\",\n[2026-09-05T00:45:16.955Z]   \"method\": \"GET\",\n[2026-09-05T00:45:16.955Z]   \"userAgent\": \"curl/8.7.1\",\n[2026-09-05T00:45:16.955Z]   \"Authorization\": \"Bearer [REDACTED:bearer-token]\",\n[2026-09-05T00:45:16.955Z]   \"uri\": \"/api/hello?code=[REDACTED:function-key]\"\n[2026-09-05T00:45:16.955Z] }"
    },
    {
      "id": "e1",
      "sequence": 1,
      "timestamp": "2026-09-05T00:45:17.206Z",
      "elapsedMs": 251,
      "lane": "host",
      "event": "InvocationStarted",
      "invocationId": "6a8f3658-2b31-4554-aa86-1ee32a9e679b",
      "confidence": "observed",
      "raw": "[2026-09-05T00:45:17.206Z] Executing 'Functions.hello' (Reason='This function was programmatically called via the host APIs.', Id=6a8f3658-2b31-4554-aa86-1ee32a9e679b)"
    },
    {
      "id": "e2",
      "sequence": 2,
      "timestamp": "2026-09-05T00:45:17.240Z",
      "elapsedMs": 285,
      "lane": "host",
      "event": "InvocationCompleted",
      "invocationId": "6a8f3658-2b31-4554-aa86-1ee32a9e679b",
      "confidence": "observed",
      "raw": "[2026-09-05T00:45:17.240Z] Executed 'Functions.hello' (Succeeded, Id=6a8f3658-2b31-4554-aa86-1ee32a9e679b, Duration=54ms)"
    },
    {
      "id": "e3",
      "sequence": 3,
      "timestamp": "2026-09-05T00:45:17.249Z",
      "elapsedMs": 294,
      "lane": "client",
      "event": "HttpResponseReturned",
      "httpRequestId": "2d0db691-8e70-4335-a8a9-e127715fa678",
      "confidence": "inferred",
      "raw": "[2026-09-05T00:45:17.249Z] Executed HTTP request: {\n[2026-09-05T00:45:17.249Z]   \"requestId\": \"2d0db691-8e70-4335-a8a9-e127715fa678\",\n[2026-09-05T00:45:17.249Z]   \"identities\": \"(WebJobsAuthLevel:Admin)\",\n[2026-09-05T00:45:17.249Z]   \"status\": \"200\",\n[2026-09-05T00:45:17.249Z]   \"duration\": \"294\"\n[2026-09-05T00:45:17.249Z] }"
    }
  ],
  "intervals": [
    {
      "id": "i1",
      "label": "Invocation (host log delta)",
      "lane": "host",
      "kind": "invocation",
      "startEvent": "e1",
      "endEvent": "e2",
      "durationMs": 34,
      "source": "log-delta",
      "confidence": "observed"
    },
    {
      "id": "i2",
      "label": "Invocation (host-reported)",
      "lane": "host",
      "kind": "invocation",
      "startEvent": "e1",
      "endEvent": "e2",
      "durationMs": 54,
      "source": "host-reported",
      "confidence": "observed",
      "raw": "Duration=54ms"
    },
    {
      "id": "i3",
      "label": "HTTP request",
      "lane": "client",
      "kind": "http",
      "startEvent": "e0",
      "endEvent": "e3",
      "durationMs": 294,
      "source": "http-reported",
      "confidence": "inferred",
      "raw": "\"duration\": \"294\""
    }
  ]
}
